{
  "version": "2.0.0",
  "environment": "shared",
  "defaults": {
    "geo_enforcement_enabled": false,
    "csp_mode": "report-only",
    "log_sensitive_fields": false,
    "verified_crawlers_challenged": false,
    "broad_automation_block_enabled": false,
    "provider_changes_applied": false
  },
  "rules": [
    {
      "id": "ddos.provider-managed",
      "description": "Use provider-managed network and application DDoS mitigation without treating ordinary traffic spikes as attacks.",
      "category": "ddos",
      "scope": "all-protected-hosts",
      "priority": 50,
      "action": "route",
      "rollout_mode": "enforce",
      "log_level": "security_event",
      "enabled": true,
      "match": {"layers": ["l3", "l4", "l7"], "adaptive": true},
      "exceptions": ["capacity and sensitivity overrides remain provider-plan/operator settings"],
      "expires_at": null,
      "owner": "platform-security",
      "change_ticket": null,
      "rationale": "Managed adaptive mitigation absorbs volumetric attacks without a guessed static default-deny rule."
    },
    {
      "id": "bot.verified-crawlers",
      "description": "Preserve access for provider-verified search crawlers while retaining managed exploit inspection.",
      "category": "bot",
      "scope": "bot-challenge-layer-only",
      "priority": 100,
      "action": "allow",
      "rollout_mode": "enforce",
      "log_level": "metadata",
      "enabled": true,
      "match": {"provider_verified_bot": true},
      "exceptions": ["does not skip managed WAF"],
      "expires_at": null,
      "owner": "platform-security",
      "change_ticket": null,
      "rationale": "Avoid SEO false positives without trusting spoofable user-agent strings."
    },
    {
      "id": "bot.trusted-operations",
      "description": "Exclude explicitly reviewed monitoring and internal-automation CIDRs from generic bot challenges while retaining managed exploit inspection.",
      "category": "bot",
      "scope": "bot-and-rate-layers-only",
      "priority": 110,
      "action": "allow",
      "rollout_mode": "enforce",
      "log_level": "metadata",
      "enabled": true,
      "match": {"identities": ["trusted_monitoring_cidrs", "approved_internal_automation_cidrs"]},
      "exceptions": ["does not skip managed WAF", "lists must be explicit, minimal, owned, and reviewed"],
      "expires_at": null,
      "owner": "platform-security",
      "change_ticket": null,
      "rationale": "Known service traffic should remain reliable without becoming a broad WAF bypass."
    },
    {
      "id": "bot.normal-browsers",
      "description": "Allow ordinary browser traffic that has no corroborated automation or abuse signal.",
      "category": "bot",
      "scope": "public-browser-routes",
      "priority": 120,
      "action": "log",
      "rollout_mode": "observe",
      "log_level": "metadata",
      "enabled": true,
      "match": {"signals_absent": ["low_bot_score", "headless", "scanner_user_agent", "abusive_rate", "repeated_challenge_failure"]},
      "exceptions": ["managed WAF and route limits still evaluate independently"],
      "expires_at": null,
      "owner": "platform-security",
      "change_ticket": null,
      "rationale": "The baseline must not force challenges on normal users."
    },
    {
      "id": "waf.managed-baseline",
      "description": "Use provider managed rules for injection, XSS, file inclusion, command injection, exploit signatures and protocol anomalies.",
      "category": "managed_waf",
      "scope": "public-and-api",
      "priority": 1000,
      "action": "log",
      "rollout_mode": "observe",
      "log_level": "security_event",
      "enabled": true,
      "match": {"classes": ["sqli", "xss", "lfi", "rfi", "command_injection", "known_exploit", "protocol_anomaly"]},
      "exceptions": ["verified signed webhook traffic may require route-specific managed-rule exceptions"],
      "expires_at": null,
      "owner": "platform-security",
      "change_ticket": null,
      "rationale": "Stage managed protections before broad enforcement."
    },
    {
      "id": "waf.unexpected-method-static",
      "description": "Detect methods other than GET, HEAD and OPTIONS on the static public hostname.",
      "category": "custom_waf",
      "scope": "static-origin",
      "priority": 1200,
      "action": "log",
      "rollout_mode": "observe",
      "log_level": "security_event",
      "enabled": true,
      "match": {"allowed_methods": ["GET", "HEAD", "OPTIONS"]},
      "exceptions": ["future dynamic routes must be moved to an API hostname before enabling write methods"],
      "expires_at": null,
      "owner": "platform-security",
      "change_ticket": null,
      "rationale": "GitHub Pages does not require write methods for static delivery."
    },
    {
      "id": "waf.path-traversal-probing",
      "description": "Challenge path traversal and common scanner/probing request patterns.",
      "category": "custom_waf",
      "scope": "public-and-api",
      "priority": 1300,
      "action": "log",
      "rollout_mode": "observe",
      "log_level": "security_event",
      "enabled": true,
      "match": {"patterns": ["../", "%2e%2e", "/.git/", "/.env", "/wp-admin", "/phpmyadmin"]},
      "exceptions": [],
      "expires_at": null,
      "owner": "platform-security",
      "change_ticket": null,
      "rationale": "High-signal probing should not reach the origin unchecked."
    },
    {
      "id": "waf.request-size-anomaly",
      "description": "Observe excessive URI, query, header, and plan-supported body sizes before any blocking promotion.",
      "category": "custom_waf",
      "scope": "all-protected-hosts",
      "priority": 1310,
      "action": "log",
      "rollout_mode": "observe",
      "log_level": "security_event",
      "enabled": true,
      "match": {"max_uri_bytes": 16384, "max_query_bytes": 8192, "max_single_header_value_bytes": 8192, "body_rule_plan_gated": true},
      "exceptions": ["trusted operational CIDRs remain visible to managed WAF"],
      "expires_at": null,
      "owner": "platform-security",
      "change_ticket": null,
      "rationale": "Oversized metadata is suspicious but can have legitimate edge cases, so the baseline observes first."
    },
    {
      "id": "bot.suspicious-automation",
      "description": "Challenge suspicious unverified automation without blocking all non-browser clients.",
      "category": "bot",
      "scope": "public",
      "priority": 2000,
      "action": "managed_challenge",
      "rollout_mode": "challenge",
      "log_level": "security_event",
      "enabled": true,
      "match": {"signals": ["low_bot_score", "headless", "scanner_user_agent", "repeated_challenge_failure"]},
      "exceptions": ["verified crawlers", "trusted monitoring CIDRs", "approved internal automation"],
      "expires_at": null,
      "owner": "platform-security",
      "change_ticket": null,
      "rationale": "Use behavioral/provider signals and challenge uncertain automation."
    },
    {
      "id": "bot.repeated-challenge-failure-quarantine",
      "description": "Provide a disabled, time-bounded block template for sources that repeatedly fail managed challenges and have corroborating abuse evidence.",
      "category": "bot",
      "scope": "public-browser-routes",
      "priority": 2010,
      "action": "block",
      "rollout_mode": "disabled",
      "log_level": "security_event",
      "enabled": false,
      "match": {"signals": ["repeated_challenge_failure", "confirmed_abuse_correlation"]},
      "exceptions": ["verified crawlers", "trusted monitoring", "approved internal automation"],
      "expires_at": null,
      "owner": "platform-security",
      "change_ticket": null,
      "rationale": "A permanent block is unsafe; incident responders may instantiate only a reviewed expiring quarantine rule."
    },
    {
      "id": "reputation.anonymous-network",
      "description": "Observe or challenge anonymous proxy, VPN and Tor signals according to route sensitivity.",
      "category": "ip_reputation",
      "scope": "public-and-api",
      "priority": 2200,
      "action": "log",
      "rollout_mode": "observe",
      "log_level": "security_event",
      "enabled": true,
      "match": {"signals": ["provider_threat_intel", "anonymous_proxy", "vpn", "tor_exit"]},
      "exceptions": ["never create a permanent deny from an unverified reputation signal alone"],
      "expires_at": null,
      "owner": "platform-security",
      "change_ticket": null,
      "rationale": "Reputation is corroborating evidence, not identity."
    },
    {
      "id": "ratelimit.static-assets",
      "description": "Observe high-volume static asset requests with a generous baseline threshold.",
      "category": "rate_limit",
      "scope": "assets",
      "priority": 3000,
      "action": "rate_limit",
      "rollout_mode": "observe",
      "log_level": "security_event",
      "enabled": true,
      "match": {"path_class": "static_asset"},
      "threshold": {"requests": 600, "period_seconds": 60, "characteristic": "ip"},
      "exceptions": ["verified crawlers", "trusted monitoring"],
      "expires_at": null,
      "owner": "platform-security",
      "change_ticket": null,
      "rationale": "Detect abusive asset scraping without interfering with normal page loads."
    },
    {
      "id": "ratelimit.html",
      "description": "Observe excessive HTML document request rates per source IP.",
      "category": "rate_limit",
      "scope": "html",
      "priority": 3010,
      "action": "rate_limit",
      "rollout_mode": "observe",
      "log_level": "security_event",
      "enabled": true,
      "match": {"path_class": "html_document"},
      "threshold": {"requests": 120, "period_seconds": 60, "characteristic": "ip"},
      "exceptions": ["verified crawlers", "trusted monitoring"],
      "expires_at": null,
      "owner": "platform-security",
      "change_ticket": null,